{
  "schema_version": "1.0",
  "decision_id": "risk_plan_demo_001",
  "plan_id": "plan_demo_001",
  "plan_hash": "aaaaaaaaaaaaaaaaaaaaaaaaaaaaaaaaaaaaaaaaaaaaaaaaaaaaaaaaaaaaaaaa",
  "session_id": "session_2026-07-20",
  "occurred_at_utc": "2026-07-20T14:30:01Z",
  "decision": "APPROVED",
  "reason_codes": [],
  "manual_confirmation_required": true,
  "rule_version": "rules_p3_1.0.0"
}
